{
  "catalogVersion": "1.0.0",
  "frameworkVersion": "0.77.3",
  "generatedAt": "2026-03-31T21:56:28.295Z",
  "baseUrl": "https://github.com/rubrical-works/idpf-praxis-skills/releases/download",
  "skillCount": 38,
  "skills": [
    {
      "name": "anti-pattern-analysis",
      "version": "1.0.0",
      "frameworkCompatibility": ">=0.60.0",
      "category": "code-quality",
      "description": "Systematic detection of anti-patterns during code review with actionable refactoring guidance",
      "relevantTechStack": [
        "javascript",
        "typescript",
        "python",
        "java",
        "go",
        "rust",
        "ruby",
        "csharp"
      ],
      "invocationMode": "auto",
      "checksum": "e8f929d6fb7e343ab97b0c95514377275cdd858786f6bfdd081864fe37c40ab1",
      "size": 43126,
      "lastUpdated": "2026-03-17",
      "assetFilename": "anti-pattern-analysis.zip",
      "defaultSkill": true
    },
    {
      "name": "api-versioning",
      "version": "1.0.0",
      "frameworkCompatibility": ">=0.60.0",
      "category": "architecture",
      "description": "Guide developers through API versioning strategies, deprecation workflows, and backward compatibility patterns",
      "relevantTechStack": [
        "rest",
        "graphql",
        "api",
        "node",
        "express"
      ],
      "invocationMode": "auto",
      "checksum": "c853bd819e41785d7e7507f67169822fad4b6b5ec071a7f91fd4ae8a594748c7",
      "size": 15687,
      "lastUpdated": "2026-03-17",
      "assetFilename": "api-versioning.zip"
    },
    {
      "name": "astro-development",
      "version": "1.0.0",
      "frameworkCompatibility": ">=0.60.0",
      "category": "platform",
      "description": "Architectural decision patterns for Astro web framework — Islands hydration, Content Collections, multi-framework integration, and deployment",
      "relevantTechStack": [
        "astro",
        "javascript",
        "typescript",
        "react",
        "vue",
        "svelte"
      ],
      "invocationMode": "auto",
      "checksum": "b7e04f9a4a1e8888485dc4912d316ecfa52975b7556e8be889950f7cfc853d41",
      "size": 14344,
      "lastUpdated": "2026-03-17",
      "assetFilename": "astro-development.zip"
    },
    {
      "name": "bdd-writing",
      "version": "1.0.0",
      "frameworkCompatibility": ">=0.60.0",
      "category": "testing",
      "description": "Guide developers on writing BDD specifications using Gherkin syntax, feature files, and step definitions",
      "relevantTechStack": [
        "cucumber",
        "gherkin",
        "bdd",
        "javascript",
        "typescript"
      ],
      "invocationMode": "direct-only",
      "checksum": "05acb1b00649fa99b5e93afd537f2ce39712c8d3f59ddad63d501b44b1805220",
      "size": 19963,
      "lastUpdated": "2026-03-17",
      "assetFilename": "bdd-writing.zip"
    },
    {
      "name": "beginner-testing",
      "version": "1.0.0",
      "frameworkCompatibility": ">=0.60.0",
      "category": "testing",
      "description": "Introduce test-driven development to beginners with simple Flask/Sinatra test examples and TDD concepts",
      "relevantTechStack": [
        "flask",
        "sinatra",
        "python",
        "ruby",
        "tdd"
      ],
      "invocationMode": "auto",
      "checksum": "df20a4306a867e000114da3976596674e2067d709bf14072edc54b4f8aabe48f",
      "size": 9551,
      "lastUpdated": "2026-03-17",
      "assetFilename": "beginner-testing.zip"
    },
    {
      "name": "ci-cd-pipeline-design",
      "version": "1.0.0",
      "frameworkCompatibility": ">=0.60.0",
      "category": "devops",
      "description": "Guide developers through CI/CD pipeline design including architecture patterns, stage design, and security considerations",
      "relevantTechStack": [
        "github-actions",
        "ci",
        "cd",
        "docker",
        "kubernetes"
      ],
      "invocationMode": "direct-only",
      "checksum": "bf36c4f6ef35f4fd7dbc1d34051619b3a31ddc23ecfcda0494b8694d01f32992",
      "size": 19178,
      "lastUpdated": "2026-03-17",
      "assetFilename": "ci-cd-pipeline-design.zip"
    },
    {
      "name": "code-path-discovery",
      "version": "1.0.0",
      "frameworkCompatibility": ">=0.60.0",
      "category": "analysis",
      "description": "Scan TypeScript/JavaScript source files for behavioral paths and return candidates in 6-category format for /paths turn-based discovery",
      "relevantTechStack": [
        "javascript",
        "typescript"
      ],
      "invocationMode": "manual",
      "checksum": "7fd2c4b26e23e120a3a36e2c227dfce3686023e82a8c43388b3dc9c2dd39cf6a",
      "size": 8485,
      "lastUpdated": "2026-03-17",
      "assetFilename": "code-path-discovery.zip",
      "defaultSkill": false
    },
    {
      "name": "codebase-analysis",
      "version": "1.0.0",
      "frameworkCompatibility": ">=0.60.0",
      "category": "code-quality",
      "description": "Analyze existing codebases to extract structure, tech stack, and patterns",
      "relevantTechStack": [
        "javascript",
        "typescript",
        "python",
        "java",
        "go",
        "rust",
        "ruby",
        "php",
        "swift",
        "elixir",
        "kotlin",
        "csharp"
      ],
      "invocationMode": "direct-only",
      "checksum": "8233793fd0bac7b7698af486a046fc7901dc70ed5447902004ca1595f572bf75",
      "size": 15497,
      "lastUpdated": "2026-03-17",
      "assetFilename": "codebase-analysis.zip",
      "defaultSkill": true
    },
    {
      "name": "command-spec-audit",
      "version": "1.0.0",
      "frameworkCompatibility": ">=0.60.0",
      "category": "code-quality",
      "description": "Evaluate command specifications for quality, completeness, and extension point coverage",
      "relevantTechStack": [],
      "invocationMode": "direct-only",
      "checksum": "82fa25609968a493c69ce1929463e5da7f92c6d1b8dcedda4f74ac61045505f9",
      "size": 3885,
      "lastUpdated": "2026-03-17",
      "assetFilename": "command-spec-audit.zip"
    },
    {
      "name": "common-errors",
      "version": "1.0.0",
      "frameworkCompatibility": ">=0.60.0",
      "category": "debugging",
      "description": "Diagnose and solve common beginner programming mistakes in Flask or Sinatra development with detailed explanations",
      "relevantTechStack": [
        "flask",
        "sinatra",
        "python",
        "ruby"
      ],
      "invocationMode": "auto",
      "checksum": "92b97b647e002b5c1e7bfb0d7a9542ff241a14b6dfa3349fc06c83a00355d4c1",
      "size": 12147,
      "lastUpdated": "2026-03-17",
      "assetFilename": "common-errors.zip"
    },
    {
      "name": "digitalocean-app-setup",
      "version": "1.0.0",
      "frameworkCompatibility": ">=0.60.0",
      "category": "platform",
      "description": "Configure automated preview, staging, and production deployments with DigitalOcean App Platform",
      "relevantTechStack": [
        "digitalocean",
        "docker",
        "node",
        "python"
      ],
      "invocationMode": "direct-only",
      "checksum": "4357abbe6bc60ca7a9b9f8a6479d29935214f9e02a8139c75bef9408778e989a",
      "size": 3936,
      "lastUpdated": "2026-03-17",
      "assetFilename": "digitalocean-app-setup.zip"
    },
    {
      "name": "drawio-generation",
      "version": "1.0.0",
      "frameworkCompatibility": ">=0.60.0",
      "category": "documentation",
      "description": "Generate valid .drawio.svg diagrams with editable mxGraphModel structure",
      "relevantTechStack": [
        "drawio",
        "diagrams",
        "svg",
        "uml",
        "documentation"
      ],
      "invocationMode": "auto",
      "checksum": "f391c1ca8a07fee367f775ab65399e3c3dc751c29593e2cdce6368acb2b37a31",
      "size": 9994,
      "lastUpdated": "2026-03-17",
      "assetFilename": "drawio-generation.zip",
      "defaultSkill": true
    },
    {
      "name": "electron-cross-build",
      "version": "1.0.0",
      "frameworkCompatibility": ">=0.60.0",
      "category": "platform",
      "description": "Cross-compile Electron apps from Linux to produce Windows executables",
      "relevantTechStack": [
        "electron",
        "linux",
        "windows",
        "wine",
        "docker",
        "electron-builder",
        "electron-forge"
      ],
      "invocationMode": "auto",
      "checksum": "637f4914b01f6f9559a7de22a2d43804fb137a2e43aad43c8c254a6e389f9e48",
      "size": 10517,
      "lastUpdated": "2026-03-17",
      "assetFilename": "electron-cross-build.zip"
    },
    {
      "name": "electron-development",
      "version": "1.0.0",
      "frameworkCompatibility": ">=0.60.0",
      "category": "platform",
      "description": "Patterns and solutions for Electron app development with Vite, Playwright E2E testing, and Windows platform considerations",
      "relevantTechStack": [
        "electron",
        "vite",
        "playwright",
        "typescript",
        "windows"
      ],
      "invocationMode": "auto",
      "checksum": "70ff9d4c5298b77a1f0dc47fdfa1f317e0df686160ead8f896c8cee36993529d",
      "size": 25931,
      "lastUpdated": "2026-03-17",
      "assetFilename": "electron-development.zip"
    },
    {
      "name": "error-handling-patterns",
      "version": "1.0.0",
      "frameworkCompatibility": ">=0.60.0",
      "category": "architecture",
      "description": "Guide developers through consistent error handling including error hierarchies, API responses, and logging integration",
      "relevantTechStack": [
        "javascript",
        "typescript",
        "python",
        "go",
        "rust",
        "java",
        "node",
        "error-handling"
      ],
      "invocationMode": "auto",
      "checksum": "cb878cce5b951f8b96792ddef69c0699c402cbb6106d2d6f6823b8d6d848ec18",
      "size": 16947,
      "lastUpdated": "2026-03-17",
      "assetFilename": "error-handling-patterns.zip",
      "defaultSkill": true
    },
    {